req_id,category,subcategory,requirement_text,target_value,test_module,test_function,validation_method,status,priority,phase,notes,effort_weeks,dependencies,blocks,assignee,sprint,started_date,completed_date,requirement_file
REQ-AUTH-001,AUTH,VIA,Configure VIA authentication provider for mergecombinator.com,VIA OAuth flow works for MC domain,,,Manual Test,COMPLETE,CRITICAL,1,"OAuth provider 'defense-builders' configured with client_id mc-web-prod. 5 redirect URIs. Cloudflare Worker at /auth/* implements PKCE flow. Manual testing remaining.",1.0,,,REQ-AUTH-002,,2026-01-25,2026-01-25,.rtmx/requirements/AUTH/REQ-AUTH-001.md
REQ-AUTH-002,AUTH,SERVICE,Add client-side auth service for VIA integration,Auth state managed in browser,,,Manual Test,COMPLETE,HIGH,1,"Implemented at js/builders/auth.js. Cloudflare Worker at cloudflare/auth.js handles PKCE. APIs: isAuthenticated() getUser() redirectToLogin() getLogoutUrl().",1.0,REQ-AUTH-001,,REQ-CONTENT-001,,2026-01-25,2026-01-26,.rtmx/requirements/AUTH/REQ-AUTH-002.md
REQ-AUTH-003,AUTH,UI,Add account management and logout to site UI,User can see account info and sign out from header,,,Visual Test,COMPLETE,LOW,2,"Implemented in js/auth-nav.js: user avatar with initial, display name, dropdown with Operations Console and Terminate Session. Done as part of REQ-CONTENT-002.",0.5,REQ-AUTH-002,,,,2026-01-26,2026-01-26,.rtmx/requirements/AUTH/REQ-AUTH-003.md
REQ-BUG-001,BUGS,VIA,VIA passkey flow allows attempt on unconfigured domains then shows poor error UX,Passkey option hidden or error page provides clear recovery path,,,Manual Test,PARTIAL,MEDIUM,1,"PARTIAL: Custom flow template injects error detection script. Passkey cancel/WebAuthn errors show recovery popup. Identification errors (unknown email) don't trigger popup - shadow DOM blocks text detection. Template at /via/authentik/custom-templates/if/flow.html.",0.5,,,,,,2026-01-26,,.rtmx/requirements/BUGS/REQ-BUG-001.md
REQ-BUG-002,BUGS,VIA,Investigate existing passkey-hide policy for reuse,Find and evaluate existing stage/policy that hides passkey option,,,Manual Test,COMPLETE,LOW,1,"Research complete. Found WebAuthnDevice pattern in via-oauth-flow.yaml. Recommendation: SKIP implementation - BUG-001 recovery page approach is better UX.",0.25,REQ-BUG-001,,,,2026-01-26,2026-01-26,.rtmx/requirements/BUGS/REQ-BUG-002.md
REQ-CONTENT-001,CONTENT,BUILDERS,Builder modals shall show restricted fields only to authenticated users,Private fields (videoUrl pitchUrl) require auth,,,Manual Test,COMPLETE,HIGH,2,"Enhanced auth gating in js/builders/components.js. Resources section shows placeholder for unauthenticated users. C2UX compliant language. CTA box shows different actions based on auth state.",0.5,REQ-AUTH-002,,,,2026-01-26,2026-01-26,.rtmx/requirements/CONTENT/REQ-CONTENT-001.md
REQ-CONTENT-002,CONTENT,UI,Add auth UI components to site header,Login/logout buttons visible and functional,,,Visual Test,COMPLETE,HIGH,2,"Auth UI in header across 11 pages. js/auth-nav.js dynamically shows Authenticate button or user dropdown. C2UX language: Authenticate Operations Console Terminate Session.",0.5,REQ-AUTH-002,,,,2026-01-26,2026-01-26,.rtmx/requirements/CONTENT/REQ-CONTENT-002.md
REQ-DOCS-001,DOCS,SSO,docs.mergecombinator.com shall use VIA SSO,Users authenticate once for both sites,,,Manual Test,COMPLETE,MEDIUM,3,"Outline Wiki with VIA OIDC. Cross-subdomain sessions via COOKIE_DOMAIN=.mergecombinator.com in wrangler.toml. createCookieHeader updated for domain support.",1.5,REQ-AUTH-001,,,,2026-01-30,2026-01-30,.rtmx/requirements/DOCS/REQ-DOCS-001.md
REQ-DOCS-002,DOCS,NAV,Unified navigation between mc-site and docs,Consistent header/nav across properties,,,Visual Test,COMPLETE,MEDIUM,3,"Added Docs link to main navigation across 17 HTML pages. Link goes to https://docs.mergecombinator.com. Also added to footer Resources section.",1.0,REQ-DOCS-001,,,,claude-session,2026-01-30,2026-01-30,.rtmx/requirements/DOCS/REQ-DOCS-002.md
REQ-DOCS-003,DOCS,ACCESS,Contributor access workflow for docs editors,Approved users can edit knowledge base,,,Manual Test,PARTIAL,LOW,3,"VIA group for docs-contributors. Approval workflow similar to SigmaBlox access requests. Outline Wiki permission sync.",1.0,"REQ-DOCS-001,REQ-AUTH-001",,,,claude-session,2026-01-30,,.rtmx/requirements/DOCS/REQ-DOCS-003.md
REQ-C2UX-001,C2UX,DESIGN,Evolve site toward command center UX patterns,Operational interface replacing marketing site,,,Visual Test,COMPLETE,MEDIUM,4,"index.html transformed to console layout with status rail. CSS design tokens updated for C2UX (dark theme, Inter-only, sharp edges). Navigation updated across 17 pages. Marketing language removed, testimonials removed.",2.0,REQ-CONTENT-002,,,,claude-session,2026-01-30,2026-01-30,.rtmx/requirements/C2UX/REQ-C2UX-001.md
REQ-C2UX-002,C2UX,DASHBOARD,Add ecosystem status dashboard view,Real-time ecosystem activity visible,,,Manual Test,COMPLETE,LOW,4,"Dashboard at /dashboard with builder inventory, mission coverage, recent records. Status link added to nav across 16 pages. Auto-refresh 60s. C2UX compliant panels. Docs activity deferred - requires Outline API integration.",2.0,"REQ-C2UX-001,REQ-AUTH-002",,,claude-session,,2026-01-30,2026-01-30,.rtmx/requirements/C2UX/REQ-C2UX-002.md
REQ-LEGAL-001,LEGAL,PRIVACY,Create Merge Combinator privacy policy,Compliant privacy policy at /privacy.html,,,Manual Test,COMPLETE,HIGH,2,"Comprehensive privacy policy covering VIA auth data, user profiles, analytics, cookies, Defense Builders data. GDPR/CCPA compliant.",1.0,,,,,2026-01-25,2026-01-25,.rtmx/requirements/LEGAL/REQ-LEGAL-001.md
REQ-LEGAL-002,LEGAL,PRIVACY,Create SigmaBlox privacy policy,Compliant privacy policy at sigmablox.com/privacy,,,Manual Test,COMPLETE,HIGH,2,"Ghost template custom-privacy.hbs created. Deploy theme and create Ghost page at /privacy to activate.",1.0,,,,,,2026-01-25,2026-01-26,.rtmx/requirements/LEGAL/REQ-LEGAL-002.md
REQ-AUTH-004,AUTH,UX,Prompt passkey setup after fallback login methods,"After Google/magic-link login, user sees 'Say goodbye to passwords. Setup Passkey.' prompt",,,Manual Test,BLOCKED,MEDIUM,4,"Adobe-inspired UX: when user logs in via fallback method (Google, magic link) because they couldn't use passkey/password, prompt them to set up a passkey. Reduces future friction. Requires: post-login redirect stage, passkey enrollment flow, skip/remind-later option. BLOCKED: VIA lift-and-shift in progress.",1.5,REQ-AUTH-001,,,,,,.rtmx/requirements/AUTH/REQ-AUTH-004.md
REQ-INFRA-001,INFRA,API,Create api.mergecombinator.com for VIA webhook services,VIA flows use api.mergecombinator.com instead of api.sigmablox.com,,,Manual Test,COMPLETE,MEDIUM,3,"Superseded by REQ-INFRA-004. DNS live (proxied A record). mc-api CF Worker deployed with GET /auth/post-2fa POST /api/verify-email GET /health endpoints. VIA template defaults updated to api.mergecombinator.com. Health verified live.",2.0,,,,,,,2026-02-16,.rtmx/requirements/INFRA/REQ-INFRA-001.md
REQ-MERCH-001,MERCH,FOURTHWALL,Build Fourthwall import package (CSV + assets),CSV imports with zero errors and drafts created,,,Manual Test,COMPLETE,HIGH,2,"Shopify-compatible CSV created at docs/merch/fourthwall-import.csv. Fourthwall lacks native import; CSV serves as structured data for manual entry.",0.5,,,,,claude-session,2026-01-30,2026-01-30,.rtmx/requirements/MERCH/REQ-MERCH-001.md
REQ-MERCH-002,MERCH,MOCKUPS,Create print placement sheets + mockups,Placement sheets approved for each merch category,,,Visual Test,COMPLETE,MEDIUM,2,"7 placement sheets created in docs/merch/placement-sheets/. Covers all categories with dimensions, colors, print methods.",0.5,REQ-MERCH-001,,,,claude-session,2026-01-30,2026-01-30,.rtmx/requirements/MERCH/REQ-MERCH-002.md
REQ-MERCH-003,MERCH,COPY,Finalize product copy + tags (operational tone),All listings have approved titles, descriptions, tags,,,Manual Review,COMPLETE,MEDIUM,2,"Product copy guide at docs/merch/product-copy.md. Catalog updated with standardized 5-tag taxonomy.",0.25,REQ-MERCH-001,,,,claude-session,2026-01-30,2026-01-30,.rtmx/requirements/MERCH/REQ-MERCH-003.md
REQ-BUG-003,BUGS,NAV,Missing /combine page - broken nav link across 16 pages,/combine resolves to dedicated page or nav links updated,,,Manual Test,COMPLETE,MEDIUM,2,"Created combine.html with C2UX-compliant design. 5-day timeline, participant requirements, cohort history, next session info. Added to vite.config.js build inputs.",0.5,,,,,claude-session,2026-01-30,2026-01-30,.rtmx/requirements/BUGS/REQ-BUG-003.md
REQ-BUG-004,BUGS,ASSETS,Partner logos referenced wrong path in index.html,All partner logo images load correctly,,,Visual Test,COMPLETE,LOW,2,"index.html lines 873-879 referenced assets/logos/*.svg but files were in assets/logos/partners/*.svg. Fixed path references.",0.1,,,,,claude-session,2026-01-30,2026-01-30,.rtmx/requirements/BUGS/REQ-BUG-004.md
REQ-BUG-005,BUGS,BUILD,Inconsistent script type=module loading across pages,All pages use consistent script loading pattern,,,Manual Test,COMPLETE,MEDIUM,2,"dashboard.html combine.html loaded script.js without type=module. builders.html had type=module on auth-nav.js (not needed). Standardized pattern.",0.1,,,,,claude-session,2026-01-30,2026-01-30,.rtmx/requirements/BUGS/REQ-BUG-005.md
REQ-BUG-006,BUGS,UX,Portfolio case study links non-functional (href=#),All placeholder links show pending state clearly,,,Visual Test,COMPLETE,LOW,2,"7 case study links pointed to href=#. Replaced with disabled spans and PENDING badge following C2UX explicit state doctrine.",0.25,,,,,claude-session,2026-01-30,2026-01-30,.rtmx/requirements/BUGS/REQ-BUG-006.md
REQ-UX-001,UX,MOBILE,Mobile UI/UX review and optimization for mergecombinator.com,All pages responsive and usable on mobile devices,,,Manual Test,COMPLETE,HIGH,2,Mobile audit complete. All pages pass: no horizontal scroll hamburger menu works modals scroll forms full-width. CSS has 64 media queries across 3 files.,1.0,,,,claude-session,,2026-01-31,2026-01-31,.rtmx/requirements/UX/REQ-UX-001.md
REQ-AUTH-005,AUTH,VIA,VIA local dev integration and error popup testing,Login flow works on localhost with error recovery banner,,,Manual Test,COMPLETE,MEDIUM,4,"COMPLETE with documented limitation. Passkey/WebAuthn errors trigger recovery popup via console.error intercept. Identification errors (unknown email) cannot trigger popup due to Authentik shadow DOM architecture — accepted as known limitation since passkey failures are the primary user-facing path.",1.0,"REQ-AUTH-001,REQ-BUG-001",,,,2026-02-03,2026-02-16,.rtmx/requirements/AUTH/REQ-AUTH-005.md
REQ-INFRA-003,INFRA,ROUTER,Complete MC Router restructuring per docs/refactor/restructure.md,"Turnstile works, config hardened, tests complete, subdomains ready",test-router.mjs,,Manual Test,COMPLETE,CRITICAL,1,"All acceptance criteria met. Turnstile verified. OAuth config validation. 47+ test assertions with CI. control.mergecombinator.com live on Cloud Run (control-layer service, sigmablox project). app/wingman DNS created with placeholder CF Pages deployed — pending CF Pages custom domain binding in dashboard. Deployment docs complete.",2.0,"REQ-AUTH-001,REQ-AUTH-002",,,claude-session,,2026-02-11,2026-02-14,.rtmx/requirements/INFRA/REQ-INFRA-003.md
REQ-BUG-007,BUGS,PROXY,/opportunities returns 500 from SBIR origin,sbir.mergecombinator.com responds correctly when proxied via mc-router,,,Manual Test,COMPLETE,LOW,2,"RESOLVED: Replaced SBIR proxy with dedicated Opportunities platform. CF Pages frontend at mc-opportunities.pages.dev. CF Worker API at opportunities-api.defensebuilders.workers.dev proxies DoD SBIR search API with correct topicReleaseStatus filtering. mc-router updated to proxy /opportunities to CF Pages.",0.5,,,,,,,2026-02-13,.rtmx/requirements/BUGS/REQ-BUG-007.md
REQ-UX-002,UX,THEME,Unify dark theme across all pages,Single dark-native CSS architecture,,,Visual Test,COMPLETE,HIGH,4,"Dark theme rules already merged in styles.css (lines 4695-5588). Deleted dark-theme.css and builders-dark.css. builders.css already dark-native. Removed import from programs/the-combine.html.",0.5,REQ-C2UX-001,"REQ-UX-003,REQ-UX-004",claude-session,,2026-02-10,2026-02-11,.rtmx/requirements/UX/REQ-UX-002.md
REQ-UX-003,UX,FOOTER,Add missing footers to all pages,All public pages have consistent footer,,,Visual Test,COMPLETE,MEDIUM,4,"Full footer added to access.html, guild.html. Upgraded simple footers in wingman.html, briefs.html. Dashboard intentionally omitted (C2UX).",0.25,REQ-UX-002,,,claude-session,,2026-02-12,2026-02-12,.rtmx/requirements/UX/REQ-UX-003.md
REQ-UX-004,UX,MOBILE,Mobile navigation polish,Smooth animations and proper dropdown handling,,,Manual Test,COMPLETE,MEDIUM,4,"Close menu on link click, outside tap, Escape key. Body scroll lock. Touch targets 44px minimum. Hamburger animation.",0.25,REQ-UX-002,,,claude-session,,2026-02-12,2026-02-12,.rtmx/requirements/UX/REQ-UX-004.md
REQ-UX-005,UX,HERO,Hero section enhancement,Greater visual impact on large screens,,,Visual Test,COMPLETE,LOW,4,"SVG diagram scales to 520px/600px at 1400px+/1800px+. Canvas opacity 0.6→0.75. Node density +33% on large screens. Particle spawn 2x. Parallax enhanced with rAF and canvas fade. Counters and stagger already functional.",0.5,REQ-UX-002,,,claude-session,,2026-02-13,2026-02-13,.rtmx/requirements/UX/REQ-UX-005.md
REQ-UX-006,UX,CSS,Consolidate page-specific CSS,Maintainable CSS architecture,,,Manual Test,COMPLETE,MEDIUM,4,"Extracted inline styles from all 19 pages into styles/*.css. 16 new CSS files. ~860 net lines of inline code removed.",0.5,REQ-UX-002,,,claude-session,,2026-02-13,2026-02-13,.rtmx/requirements/UX/REQ-UX-006.md
REQ-UX-007,UX,LOADING,Loading states and page transitions,Skeleton screens and smooth transitions,,,Manual Test,COMPLETE,LOW,4,"View Transitions API (MPA cross-document). Skeleton loaders on builders grid and dashboard metrics/activity/coverage. Link prefetch on hover. Expanded prefers-reduced-motion.",0.5,"REQ-UX-002,REQ-UX-006",,,claude-session,,2026-02-13,2026-02-13,.rtmx/requirements/UX/REQ-UX-007.md
REQ-INFRA-002,INFRA,GROUPS,mc-docs-contributors group infrastructure in VIA and Outline,mc-docs-contributors group exists in VIA and Outline with correct permissions,,,Manual Test,PENDING,HIGH,3,"VIA group and Outline group required for contributor access control. Blocks REQ-DOCS-003. Requires human admin action in VIA and Outline.",0.5,"REQ-AUTH-001,REQ-DOCS-001",REQ-DOCS-003,,,,,,.rtmx/requirements/INFRA/REQ-INFRA-002.md
REQ-DOCS-004,DOCS,REVIEW,Review docs and archive completed tasks,All docs reflect current state and completed tasks archived,,,Manual Review,COMPLETE,MEDIUM,5,"RTMX database audit complete. Fixed status mismatches in REQ-INFRA-003.md and REQ-BUG-007.md. Added orphaned REQ-INFRA-002 to database. Created REQ-UX-008.md. 13 sitreps reviewed.",0.25,,,,claude-session,,2026-02-14,2026-02-14,.rtmx/requirements/DOCS/REQ-DOCS-004.md
REQ-UX-008,UX,NAV,Unified modular navbar component (single source of truth),"One shared navbar component used across all pages (main site, opportunities, docs) with consistent branding and links",,,Visual Test,COMPLETE,HIGH,5,"js/navbar.js renders navbar into <div id=mc-navbar>. All 28 Vite-built pages converted. auth-nav.js removed (auth integrated into navbar.js). Dead CSS cleaned up. Active page auto-detection via pathname. Mobile menu with body scroll lock. Platform dropdown with Opportunities/Status/Briefs/Knowledge/Docs. about.html standardized to match site nav.",1.5,"REQ-UX-002,REQ-DOCS-002",,,claude-session,,2026-02-14,2026-02-14,.rtmx/requirements/UX/REQ-UX-008.md
REQ-BUG-008,BUGS,AUTH,Auth check logs console errors on every page load,Zero console errors when auth endpoint unavailable,,,Manual Test,COMPLETE,LOW,5,"Fixed: content-type guard in navbar.js and builders/auth.js. Non-JSON responses handled silently. console.error downgraded to console.debug.",0.25,REQ-AUTH-002,,,claude-session,,2026-02-14,2026-02-14,.rtmx/requirements/BUGS/REQ-BUG-008.md
REQ-BUG-009,BUGS,NAV,about.html footer has stale href=# links and outdated structure,All footer links point to real destinations matching index.html footer,,,Visual Test,COMPLETE,MEDIUM,5,"Fixed: replaced entire footer with canonical index.html footer. Real social links real resource/legal links updated logo markup 2026 copyright current locations.",0.25,,,,,claude-session,2026-02-14,2026-02-14,.rtmx/requirements/BUGS/REQ-BUG-009.md
REQ-BUG-010,BUGS,NAV,portfolio.html case study links are non-functional href=#,Case study links show PENDING state or link to real pages,,,Visual Test,COMPLETE,LOW,5,"Fixed: 1 featured + 6 grid case study links replaced with PENDING badges. CSS classes from REQ-BUG-006 reused (btn--pending portfolio-card__link--pending).",0.25,,,,,claude-session,2026-02-14,2026-02-14,.rtmx/requirements/BUGS/REQ-BUG-010.md
REQ-BUG-011,BUGS,CLEANUP,Stale files need removal (duplicate scroll-reveal.js and old combine page),No dead code in repository,,,Manual Test,COMPLETE,LOW,5,"Deleted: public/js/scroll-reveal.js (stale duplicate) and programs/the-combine-old.html (replaced by the-combine.html).",0.1,,,,,claude-session,2026-02-14,2026-02-14,.rtmx/requirements/BUGS/REQ-BUG-011.md
REQ-BUG-012,BUGS,CLEANUP,Console.log initialization messages in production JS,Zero informational console.log in production code,,,Manual Test,COMPLETE,LOW,5,"Removed all console.log from js/ dir. 20+ init/info/stats logs removed. 4 diagnostic logs downgraded to console.debug.",0.25,,,,,claude-session,2026-02-14,2026-02-14,.rtmx/requirements/BUGS/REQ-BUG-012.md
REQ-C2UX-008,C2UX,DESIGN,Global light/dark mode system with theme toggle,Theme toggle works across all pages with persistence,,,Visual Test,COMPLETE,MEDIUM,5,"All 9 acceptance criteria verified. js/theme.js + styles/light-theme.css (902 lines) + FOUC inline script on all 31 pages. Toggle in navbar via navbar.js. Persistence via localStorage. System preference detection. Smooth transitions.",0.5,"REQ-UX-008,REQ-UX-002",,claude-session,,2026-02-14,2026-02-16,.rtmx/requirements/C2UX/REQ-C2UX-008.md
REQ-BUG-013,BUGS,ASSETS,Partner logos and arrows-2.png 404 on production,All images load from CF Images,,,Visual Test,COMPLETE,HIGH,5,"Uploaded 13 images to CF Images (imagedelivery.net). Updated 30 HTML files and navbar.js. Zero local asset references remain.",0.25,,,,,claude-session,2026-02-15,2026-02-15,.rtmx/requirements/BUGS/REQ-BUG-013.md
REQ-INFRA-004,INFRA,API,Deploy mc-api Cloudflare Worker to api.mergecombinator.com,Health and post-2fa endpoints live,,,Manual Test,COMPLETE,HIGH,5,"Worker deployed with route api.mergecombinator.com/*. DNS changed from CNAME ghs.googlehosted.com to proxied A record. VIA templates updated to default to MC endpoint.",0.25,,,,,claude-session,2026-02-15,2026-02-15,.rtmx/requirements/INFRA/REQ-INFRA-004.md
REQ-C2UX-009,C2UX,DESIGN,SigmaBlox modal refactor (Builders + Access),Command plane modal treatment with sharp edges and operational typography,,,Visual Test,COMPLETE,MEDIUM,6,"All 6 acceptance criteria met. Access CSS: 6x border-radius fixed 4px→2px framed row pattern on drawer fields. Builders CSS: modal details converted to 2-col framed grid. Language: Watch Video→View Demo. Mobile responsive.",1.0,REQ-C2UX-001,,,claude-session,2026-02-16,2026-02-16,.rtmx/requirements/C2UX/REQ-C2UX-009.md
REQ-INFRA-005,INFRA,DNS,Canonical domain redirects (www/build aliases),www and build subdomains 301 redirect to apex,,,Manual Test,COMPLETE,LOW,6,"Already implemented in merge-router.js: ALIAS_HOSTS set + 301 redirect. Tests in test-router.mjs testCanonicalRedirects(). Verified live: www.mergecombinator.com → 301 → mergecombinator.com.",0.25,REQ-INFRA-003,,,claude-session,,2026-02-16,.rtmx/requirements/INFRA/REQ-INFRA-005.md
REQ-INFRA-006,INFRA,HOSTING,CF Pages custom domain binding (app/wingman),app and wingman subdomains bound to CF Pages deployments,,,Manual Test,COMPLETE,MEDIUM,6,"Both domains live: app.mergecombinator.com and wingman.mergecombinator.com returning 200 OK via CF Pages. HTTPS active. As of phase0-routing-complete: /app/* and /wingman/* are 301 redirects to guild.* and wingman.* (no longer proxied).",0.25,REQ-INFRA-003,,,claude-session,,2026-02-16,.rtmx/requirements/INFRA/REQ-INFRA-006.md
REQ-UX-009,UX,HERO,Video backgrounds for hero/mission/CTA sections,AI-generated background videos on 3 homepage sections,,,Visual Test,BACKLOG,LOW,6,"Infrastructure complete: HTML containers CSS styles JS lazy-loading placeholder gradients mobile-disable reduced-motion support. 6/7 criteria met. Awaiting 3 MP4 files from AI video generation (hero-carrier-ops mission-tactical cta-deployment). BACKLOGGED — video generation is manual/external work.",1.0,,,,claude-session,2026-02-16,,.rtmx/requirements/UX/REQ-UX-009.md
REQ-DOCS-005,DOCS,CLEANUP,Docs directory cleanup and migration,Completed docs migrated to /completed and sitreps to /archive,,,Manual Review,COMPLETE,MEDIUM,6,"18 files archived, 8 completed docs migrated, 3 empty dirs removed, 6 path references updated. Zero broken internal references.",0.25,,,,claude-session,,2026-02-16,.rtmx/requirements/DOCS/REQ-DOCS-005.md
REQ-UX-010,UX,SEO,SEO improvements across site,"Structured data, meta optimization, sitemap, performance scores",,,Automated Test,BACKLOG,MEDIUM,7,"Backlogged. JSON-LD Organization+WebSite on homepage already done. Potential: per-page JSON-LD, sitemap.xml, canonical URLs, image alt audit, Core Web Vitals optimization.",1.5,,,,,,,,.rtmx/requirements/UX/REQ-UX-010.md
REQ-CONTENT-003,CONTENT,BLOG,Blog content pipeline and new articles,Regular blog content cadence with defense tech topics,,,Manual Review,BACKLOG,MEDIUM,7,"Backlogged. 3 articles published (counter-drone, NDAA, Eisenhower). Need: editorial calendar, topic pipeline, author workflow. Blog infrastructure is complete.",1.0,,,,,,,,.rtmx/requirements/CONTENT/REQ-CONTENT-003.md
REQ-UX-011,UX,ACCESS,Redesign /access page as first-class entry point,"Consolidated access page replacing SigmaBlox join flow, simplified UX, inline form",,,Visual Test,PARTIAL,HIGH,7,"Split-panel layout shipped: left hero with Pentagon bg + features, right panel with request access form (Builders/The Combine/Guild chips) + compact sign-in (email + Google/CAC SSO). Dark/light theme verified. Mobile responsive. Remaining: replace SigmaBlox /join redirect, verify end-to-end auth flow, context-aware routing (?context=combine etc).",1.5,"REQ-UX-002,REQ-C2UX-001",,,,2026-02-19,,.rtmx/requirements/UX/REQ-UX-011.md
REQ-CONTENT-004,CONTENT,TRUTH,Complete TRUTH-003 source mapping for source-required P1 claims,"All source-required P1 claims in current source map have source_reference + verification status",,,Manual Review,PENDING,HIGH,8,"Continue claims governance after P0 closure. Focus on docs/content/claims/claims-source-map-*-current.csv rows with priority=P1 and source_requirement=required. Populate source links/attestations and verification_method.",0.5,,,,,,,,.rtmx/requirements/CONTENT/REQ-CONTENT-004.md
REQ-CONTENT-005,CONTENT,TESTIMONIALS,Replace placeholder testimonial attributions with approved sources or non-quote copy,"Homepage testimonials have approved attribution metadata or are rewritten as non-testimonial statements",,,Manual Review,PENDING,HIGH,8,"Current homepage testimonial cards still include placeholder attribution fields (Org: Pending Approval · Approval: Pending). Require signed quote approval or rewrite to non-quoted positioning copy.",0.5,"REQ-CONTENT-004",,,,,,,.rtmx/requirements/CONTENT/REQ-CONTENT-005.md
REQ-CONTENT-006,CONTENT,TRUTH,De-risk remaining factual speed/validation language on homepage and Combine page,"No unsourced high-risk factual wording remains on top funnel pages",,,Manual Review,PENDING,HIGH,8,"Use current claim inventory/review queue to soften or substantiate residual speed, validation, and deployment claims across index.html and programs/the-combine.html.",0.75,"REQ-CONTENT-004",,,,,,,.rtmx/requirements/CONTENT/REQ-CONTENT-006.md
REQ-CONTENT-007,CONTENT,ABOUT,Create About Us page with founders partners and who-we-work-with information,"About page clearly explains who MC is, founders, partners, and collaboration model with approved language",,,Visual Test,PARTIAL,CRITICAL,8,"PARTIAL: approval-safe v1 About page scaffold shipped on about.html with founders/partners/who-we-work-with sections and placeholder founder slots. Discoverability improved via navbar About link + homepage footer About link. Remaining: approved bios/partners + claim mapping + visual QA.",1.0,"REQ-CONTENT-004,REQ-UX-008",,,,,claude-session,2026-02-22,,.rtmx/requirements/CONTENT/REQ-CONTENT-007.md
REQ-DOCS-006,DOCS,TESTING,Visual artifact storage policy (repo vs CI artifacts),"Playwright screenshots and ad-hoc verification captures follow one documented storage policy",,,Manual Review,PENDING,MEDIUM,8,"Recent screenshot churn moved some visual snapshots to artifact-only, but root-level captures continue to appear. Document policy for baselines, ad-hoc captures, and retention to reduce repo noise.",0.25,,,,,,,,.rtmx/requirements/DOCS/REQ-DOCS-006.md
REQ-DOCS-007,DOCS,RTMX,RTMX database and requirement-file sync hygiene,"RTMX database rows and requirement files remain in sync with no orphan entries",,,Manual Review,PENDING,LOW,8,"Add periodic RTMX hygiene pass to reconcile database.csv rows with requirement markdown files and avoid local drift confusion (e.g., DB entries without matching files).",0.25,,,,,,,,.rtmx/requirements/DOCS/REQ-DOCS-007.md
