req_id,category,subcategory,requirement_text,target_value,test_module,test_function,validation_method,status,priority,phase,notes,effort_weeks,dependencies,blocks,assignee,sprint,started_date,completed_date,requirement_file
REQ-AUTH-001,AUTH,VIA,Configure VIA authentication provider for mergecombinator.com,VIA OAuth flow works for MC domain,,,Manual Test,COMPLETE,CRITICAL,1,"OAuth provider 'defense-builders' configured with client_id mc-web-prod. 5 redirect URIs. Cloudflare Worker at /auth/* implements PKCE flow. Manual testing remaining.",1.0,,,REQ-AUTH-002,,2026-01-25,2026-01-25,.rtmx/requirements/AUTH/REQ-AUTH-001.md
REQ-AUTH-002,AUTH,SERVICE,Add client-side auth service for VIA integration,Auth state managed in browser,,,Manual Test,COMPLETE,HIGH,1,"Implemented at js/builders/auth.js. Cloudflare Worker at cloudflare/auth.js handles PKCE. APIs: isAuthenticated() getUser() redirectToLogin() getLogoutUrl().",1.0,REQ-AUTH-001,,REQ-CONTENT-001,,2026-01-25,2026-01-26,.rtmx/requirements/AUTH/REQ-AUTH-002.md
REQ-AUTH-003,AUTH,UI,Add account management and logout to site UI,User can see account info and sign out from header,,,Visual Test,COMPLETE,LOW,2,"Implemented in js/auth-nav.js: user avatar with initial, display name, dropdown with Operations Console and Terminate Session. Done as part of REQ-CONTENT-002.",0.5,REQ-AUTH-002,,,,2026-01-26,2026-01-26,.rtmx/requirements/AUTH/REQ-AUTH-003.md
REQ-BUG-001,BUGS,VIA,VIA passkey flow allows attempt on unconfigured domains then shows poor error UX,Passkey option hidden or error page provides clear recovery path,,,Manual Test,COMPLETE,MEDIUM,1,"Recovery page at /media/via-auth-denied.html. Cloudflare Worker via-auth-helper.js created to inject error detection banner. CSS approach blocked by shadow DOM. Deploy worker to auth.sigmablox.com.",0.5,,,,,,2026-01-26,2026-01-27,.rtmx/requirements/BUGS/REQ-BUG-001.md
REQ-BUG-002,BUGS,VIA,Investigate existing passkey-hide policy for reuse,Find and evaluate existing stage/policy that hides passkey option,,,Manual Test,COMPLETE,LOW,1,"Research complete. Found WebAuthnDevice pattern in via-oauth-flow.yaml. Recommendation: SKIP implementation - BUG-001 recovery page approach is better UX.",0.25,REQ-BUG-001,,,,2026-01-26,2026-01-26,.rtmx/requirements/BUGS/REQ-BUG-002.md
REQ-CONTENT-001,CONTENT,BUILDERS,Builder modals shall show restricted fields only to authenticated users,Private fields (videoUrl pitchUrl) require auth,,,Manual Test,COMPLETE,HIGH,2,"Enhanced auth gating in js/builders/components.js. Resources section shows placeholder for unauthenticated users. C2UX compliant language. CTA box shows different actions based on auth state.",0.5,REQ-AUTH-002,,,,2026-01-26,2026-01-26,.rtmx/requirements/CONTENT/REQ-CONTENT-001.md
REQ-CONTENT-002,CONTENT,UI,Add auth UI components to site header,Login/logout buttons visible and functional,,,Visual Test,COMPLETE,HIGH,2,"Auth UI in header across 11 pages. js/auth-nav.js dynamically shows Authenticate button or user dropdown. C2UX language: Authenticate Operations Console Terminate Session.",0.5,REQ-AUTH-002,,,,2026-01-26,2026-01-26,.rtmx/requirements/CONTENT/REQ-CONTENT-002.md
REQ-DOCS-001,DOCS,SSO,docs.mergecombinator.com shall use VIA SSO,Users authenticate once for both sites,,,Manual Test,COMPLETE,MEDIUM,3,"Outline Wiki with VIA OIDC. Cross-subdomain sessions via COOKIE_DOMAIN=.mergecombinator.com in wrangler.toml. createCookieHeader updated for domain support.",1.5,REQ-AUTH-001,,,,2026-01-30,2026-01-30,.rtmx/requirements/DOCS/REQ-DOCS-001.md
REQ-DOCS-002,DOCS,NAV,Unified navigation between mc-site and docs,Consistent header/nav across properties,,,Visual Test,COMPLETE,MEDIUM,3,"Added Docs link to main navigation across 17 HTML pages. Link goes to https://docs.mergecombinator.com. Also added to footer Resources section.",1.0,REQ-DOCS-001,,,,claude-session,2026-01-30,2026-01-30,.rtmx/requirements/DOCS/REQ-DOCS-002.md
REQ-DOCS-003,DOCS,ACCESS,Contributor access workflow for docs editors,Approved users can edit knowledge base,,,Manual Test,PARTIAL,LOW,3,"VIA group for docs-contributors. Approval workflow similar to SigmaBlox access requests. Outline Wiki permission sync.",1.0,"REQ-DOCS-001,REQ-AUTH-001",,,,claude-session,2026-01-30,,.rtmx/requirements/DOCS/REQ-DOCS-003.md
REQ-C2UX-001,C2UX,DESIGN,Evolve site toward command center UX patterns,Operational interface replacing marketing site,,,Visual Test,COMPLETE,MEDIUM,4,"index.html transformed to console layout with status rail. CSS design tokens updated for C2UX (dark theme, Inter-only, sharp edges). Navigation updated across 17 pages. Marketing language removed, testimonials removed.",2.0,REQ-CONTENT-002,,,,claude-session,2026-01-30,2026-01-30,.rtmx/requirements/C2UX/REQ-C2UX-001.md
REQ-C2UX-002,C2UX,DASHBOARD,Add ecosystem status dashboard view,Real-time ecosystem activity visible,,,Manual Test,COMPLETE,LOW,4,"Dashboard at /dashboard with builder inventory, mission coverage, recent records. Status link added to nav across 16 pages. Auto-refresh 60s. C2UX compliant panels. Docs activity deferred - requires Outline API integration.",2.0,"REQ-C2UX-001,REQ-AUTH-002",,,claude-session,,2026-01-30,2026-01-30,.rtmx/requirements/C2UX/REQ-C2UX-002.md
REQ-LEGAL-001,LEGAL,PRIVACY,Create Merge Combinator privacy policy,Compliant privacy policy at /privacy.html,,,Manual Test,COMPLETE,HIGH,2,"Comprehensive privacy policy covering VIA auth data, user profiles, analytics, cookies, Defense Builders data. GDPR/CCPA compliant.",1.0,,,,,2026-01-25,2026-01-25,.rtmx/requirements/LEGAL/REQ-LEGAL-001.md
REQ-LEGAL-002,LEGAL,PRIVACY,Create SigmaBlox privacy policy,Compliant privacy policy at sigmablox.com/privacy,,,Manual Test,COMPLETE,HIGH,2,"Ghost template custom-privacy.hbs created. Deploy theme and create Ghost page at /privacy to activate.",1.0,,,,,,2026-01-25,2026-01-26,.rtmx/requirements/LEGAL/REQ-LEGAL-002.md
REQ-AUTH-004,AUTH,UX,Prompt passkey setup after fallback login methods,"After Google/magic-link login, user sees 'Say goodbye to passwords. Setup Passkey.' prompt",,,Manual Test,PENDING,MEDIUM,4,"Adobe-inspired UX: when user logs in via fallback method (Google, magic link) because they couldn't use passkey/password, prompt them to set up a passkey. Reduces future friction. Requires: post-login redirect stage, passkey enrollment flow, skip/remind-later option.",1.5,REQ-AUTH-001,,,,,,.rtmx/requirements/AUTH/REQ-AUTH-004.md
REQ-INFRA-001,INFRA,API,Create api.mergecombinator.com for VIA webhook services,VIA flows use api.mergecombinator.com instead of api.sigmablox.com,,,Manual Test,PENDING,MEDIUM,3,"DNS: api.mergecombinator.com doesn't exist yet. Needs: 1) DNS record, 2) Cloudflare Worker or Cloud Run service, 3) Update VIA flow templates api_base default, 4) Update via/config. Templates already config-driven via {{ api_base }}. SigmaBlox-specific content stays on api.sigmablox.com.",2.0,,,,,,,.rtmx/requirements/INFRA/REQ-INFRA-001.md
REQ-MERCH-001,MERCH,FOURTHWALL,Build Fourthwall import package (CSV + assets),CSV imports with zero errors and drafts created,,,Manual Test,COMPLETE,HIGH,2,"Shopify-compatible CSV created at docs/merch/fourthwall-import.csv. Fourthwall lacks native import; CSV serves as structured data for manual entry.",0.5,,,,,claude-session,2026-01-30,2026-01-30,.rtmx/requirements/MERCH/REQ-MERCH-001.md
REQ-MERCH-002,MERCH,MOCKUPS,Create print placement sheets + mockups,Placement sheets approved for each merch category,,,Visual Test,COMPLETE,MEDIUM,2,"7 placement sheets created in docs/merch/placement-sheets/. Covers all categories with dimensions, colors, print methods.",0.5,REQ-MERCH-001,,,,claude-session,2026-01-30,2026-01-30,.rtmx/requirements/MERCH/REQ-MERCH-002.md
REQ-MERCH-003,MERCH,COPY,Finalize product copy + tags (operational tone),All listings have approved titles, descriptions, tags,,,Manual Review,COMPLETE,MEDIUM,2,"Product copy guide at docs/merch/product-copy.md. Catalog updated with standardized 5-tag taxonomy.",0.25,REQ-MERCH-001,,,,claude-session,2026-01-30,2026-01-30,.rtmx/requirements/MERCH/REQ-MERCH-003.md
REQ-BUG-003,BUGS,NAV,Missing /combine page - broken nav link across 16 pages,/combine resolves to dedicated page or nav links updated,,,Manual Test,COMPLETE,MEDIUM,2,"Created combine.html with C2UX-compliant design. 5-day timeline, participant requirements, cohort history, next session info. Added to vite.config.js build inputs.",0.5,,,,,claude-session,2026-01-30,2026-01-30,.rtmx/requirements/BUGS/REQ-BUG-003.md
REQ-BUG-004,BUGS,ASSETS,Partner logos referenced wrong path in index.html,All partner logo images load correctly,,,Visual Test,COMPLETE,LOW,2,"index.html lines 873-879 referenced assets/logos/*.svg but files were in assets/logos/partners/*.svg. Fixed path references.",0.1,,,,,claude-session,2026-01-30,2026-01-30,.rtmx/requirements/BUGS/REQ-BUG-004.md
REQ-BUG-005,BUGS,BUILD,Inconsistent script type=module loading across pages,All pages use consistent script loading pattern,,,Manual Test,COMPLETE,MEDIUM,2,"dashboard.html combine.html loaded script.js without type=module. builders.html had type=module on auth-nav.js (not needed). Standardized pattern.",0.1,,,,,claude-session,2026-01-30,2026-01-30,.rtmx/requirements/BUGS/REQ-BUG-005.md
REQ-BUG-006,BUGS,UX,Portfolio case study links non-functional (href=#),All placeholder links show pending state clearly,,,Visual Test,COMPLETE,LOW,2,"7 case study links pointed to href=#. Replaced with disabled spans and PENDING badge following C2UX explicit state doctrine.",0.25,,,,,claude-session,2026-01-30,2026-01-30,.rtmx/requirements/BUGS/REQ-BUG-006.md
REQ-UX-001,UX,MOBILE,Mobile UI/UX review and optimization for mergecombinator.com,All pages responsive and usable on mobile devices,,,Manual Test,PENDING,HIGH,2,Comprehensive mobile review: touch targets navigation menus form inputs modals and responsive layouts. Test on iOS and Android devices.,1.0,,,,backlog,,,,.rtmx/requirements/UX/REQ-UX-001.md
